{
    "$schema": "./schema.json",
    "type": "external",
    "name": "strings",
    "description": "Extract printable strings from a binary file.",
    "execution": {
        "command": [
            "strings",
            "{input.0}"
        ]
    },
    "prepare-module-directory": false,
    "data": {
        "input": {
            "type": "json"
        },
        "output": {
            "type": "json"
        }
    }
}